{
  "$schema": "./oov-gold-v1.schema.json",
  "schema_version": 1,
  "authored_at": "2026-07-12T06:45:43Z",
  "independence": "Authored in a task forked before Phase 04 curation, without reading Phase 04 source data, policy code, authoring scripts, diffs, PR material, counts, hashes, or the Phase 04 turn doc.",
  "evidence_sources": [
    {
      "id": "green-aae-phonology",
      "title": "Phonology of African American English",
      "url": "https://doi.org/10.1017/CBO9780511800306.007",
      "scope": "AAE sound patterns, consonant variation, and phonological category framing."
    },
    {
      "id": "weldon-aae-variation",
      "title": "Middle-Class African American English",
      "url": "https://www.cambridge.org/core/books/middleclass-african-american-english/3B19D2A893A3E8438D6A04AB83B564CB",
      "scope": "Variation including consonant-cluster reduction, unstressed nasal variation, and lexical features."
    },
    {
      "id": "yale-tryna",
      "title": "Tryna",
      "url": "https://ygdp.yale.edu/phenomena/tryna",
      "scope": "Independent evidence for the fused colloquial form tryna and its AAE distribution."
    },
    {
      "id": "yale-null-copula",
      "title": "Null copula",
      "url": "https://ygdp.yale.edu/phenomena/null-copula",
      "scope": "Independent evidence for AAE contraction and word-final cluster reduction."
    },
    {
      "id": "hip-hop-archive",
      "title": "Hiphop Archive and Research Institute",
      "url": "https://hiphoparchive.org/",
      "scope": "Category-level evidence that hip-hop language and regional cultural material form a research corpus; not used as a pronunciation oracle."
    },
    {
      "id": "regional-aae-variation",
      "title": "Folk perception of African American English regional variation",
      "url": "https://doi.org/10.1017/jlg.2017.2",
      "scope": "Evidence that AAE and hip-hop-linked speech vary regionally, supporting explicit region labels rather than a single undifferentiated dialect."
    },
    {
      "id": "phase02-arpabet",
      "title": "Repository Phase 02 ARPAbet primitives",
      "url": "https://github.com/cmusphinx/cmudict",
      "scope": "Standard ARPAbet phone inventory and repository normalization/phone-token conventions; local legacy membership is checked separately after authoring."
    }
  ],
  "cases": [
    {
      "id": "oov-001",
      "surface": "goin'",
      "normalized": "goin",
      "accepted_pronunciations": [
        "G OW1 IH0 N"
      ],
      "category": "dropped-sound",
      "region": "national-aae",
      "evidence": [
        "green-aae-phonology",
        "weldon-aae-variation"
      ],
      "adjudication": {
        "state": "accepted",
        "rationale": "Productive unstressed -ing nasal-fronting form of going."
      },
      "legacy_cmu": {
        "status": "present-in-legacy-cmu",
        "matches": [
          "G OY1 N",
          "G OW1 AH0 N"
        ]
      }
    },
    {
      "id": "oov-002",
      "surface": "doin'",
      "normalized": "doin",
      "accepted_pronunciations": [
        "D UW1 IH0 N"
      ],
      "category": "dropped-sound",
      "region": "national-aae",
      "evidence": [
        "green-aae-phonology",
        "weldon-aae-variation"
      ],
      "adjudication": {
        "state": "accepted",
        "rationale": "Productive unstressed -ing nasal-fronting form of doing."
      },
      "legacy_cmu": {
        "status": "present-in-legacy-cmu",
        "matches": [
          "D UW1 IH0 N"
        ]
      }
    },
    {
      "id": "oov-003",
      "surface": "bein'",
      "normalized": "bein",
      "accepted_pronunciations": [
        "B IY1 IH0 N"
      ],
      "category": "dropped-sound",
      "region": "national-aae",
      "evidence": [
        "green-aae-phonology",
        "weldon-aae-variation"
      ],
      "adjudication": {
        "state": "accepted",
        "rationale": "Productive unstressed -ing nasal-fronting form of being."
      },
      "legacy_cmu": {
        "status": "present-in-legacy-cmu",
        "matches": [
          "B IY1 N",
          "B IY1 IH0 N"
        ]
      }
    },
    {
      "id": "oov-004",
      "surface": "sayin'",
      "normalized": "sayin",
      "accepted_pronunciations": [
        "S EY1 IH0 N"
      ],
      "category": "dropped-sound",
      "region": "national-aae",
      "evidence": [
        "green-aae-phonology",
        "weldon-aae-variation"
      ],
      "adjudication": {
        "state": "accepted",
        "rationale": "Productive unstressed -ing nasal-fronting form of saying."
      },
      "legacy_cmu": {
        "status": "present-in-legacy-cmu",
        "matches": [
          "S EY1 IH0 N"
        ]
      }
    },
    {
      "id": "oov-005",
      "surface": "playin'",
      "normalized": "playin",
      "accepted_pronunciations": [
        "P L EY1 IH0 N"
      ],
      "category": "dropped-sound",
      "region": "national-aae",
      "evidence": [
        "green-aae-phonology",
        "weldon-aae-variation"
      ],
      "adjudication": {
        "state": "accepted",
        "rationale": "Productive unstressed -ing nasal-fronting form of playing."
      },
      "legacy_cmu": {
        "status": "present-in-legacy-cmu",
        "matches": [
          "P L EY1 IH0 N"
        ]
      }
    },
    {
      "id": "oov-006",
      "surface": "stayin'",
      "normalized": "stayin",
      "accepted_pronunciations": [
        "S T EY1 IH0 N"
      ],
      "category": "dropped-sound",
      "region": "national-aae",
      "evidence": [
        "green-aae-phonology",
        "weldon-aae-variation"
      ],
      "adjudication": {
        "state": "accepted",
        "rationale": "Productive unstressed -ing nasal-fronting form of staying."
      },
      "legacy_cmu": {
        "status": "confirmed-oov",
        "matches": []
      }
    },
    {
      "id": "oov-007",
      "surface": "makin'",
      "normalized": "makin",
      "accepted_pronunciations": [
        "M EY1 K IH0 N"
      ],
      "category": "dropped-sound",
      "region": "national-aae",
      "evidence": [
        "green-aae-phonology",
        "weldon-aae-variation"
      ],
      "adjudication": {
        "state": "accepted",
        "rationale": "Productive unstressed -ing nasal-fronting form of making."
      },
      "legacy_cmu": {
        "status": "present-in-legacy-cmu",
        "matches": [
          "M AE1 K IH0 N",
          "M EY1 K IH0 N"
        ]
      }
    },
    {
      "id": "oov-008",
      "surface": "takin'",
      "normalized": "takin",
      "accepted_pronunciations": [
        "T EY1 K IH0 N"
      ],
      "category": "dropped-sound",
      "region": "national-aae",
      "evidence": [
        "green-aae-phonology",
        "weldon-aae-variation"
      ],
      "adjudication": {
        "state": "accepted",
        "rationale": "Productive unstressed -ing nasal-fronting form of taking."
      },
      "legacy_cmu": {
        "status": "present-in-legacy-cmu",
        "matches": [
          "T EY1 K IH0 N"
        ]
      }
    },
    {
      "id": "oov-009",
      "surface": "breakin'",
      "normalized": "breakin",
      "accepted_pronunciations": [
        "B R EY1 K IH0 N"
      ],
      "category": "dropped-sound",
      "region": "national-aae",
      "evidence": [
        "green-aae-phonology",
        "weldon-aae-variation"
      ],
      "adjudication": {
        "state": "accepted",
        "rationale": "Productive unstressed -ing nasal-fronting form of breaking."
      },
      "legacy_cmu": {
        "status": "confirmed-oov",
        "matches": []
      }
    },
    {
      "id": "oov-010",
      "surface": "shakin'",
      "normalized": "shakin",
      "accepted_pronunciations": [
        "SH EY1 K IH0 N"
      ],
      "category": "dropped-sound",
      "region": "national-aae",
      "evidence": [
        "green-aae-phonology",
        "weldon-aae-variation"
      ],
      "adjudication": {
        "state": "accepted",
        "rationale": "Productive unstressed -ing nasal-fronting form of shaking."
      },
      "legacy_cmu": {
        "status": "confirmed-oov",
        "matches": []
      }
    },
    {
      "id": "oov-011",
      "surface": "chasin'",
      "normalized": "chasin",
      "accepted_pronunciations": [
        "CH EY1 S IH0 N"
      ],
      "category": "dropped-sound",
      "region": "national-aae",
      "evidence": [
        "green-aae-phonology",
        "weldon-aae-variation"
      ],
      "adjudication": {
        "state": "accepted",
        "rationale": "Productive unstressed -ing nasal-fronting form of chasing."
      },
      "legacy_cmu": {
        "status": "present-in-legacy-cmu",
        "matches": [
          "CH AE1 S IH0 N"
        ]
      }
    },
    {
      "id": "oov-012",
      "surface": "racin'",
      "normalized": "racin",
      "accepted_pronunciations": [
        "R EY1 S IH0 N"
      ],
      "category": "dropped-sound",
      "region": "national-aae",
      "evidence": [
        "green-aae-phonology",
        "weldon-aae-variation"
      ],
      "adjudication": {
        "state": "accepted",
        "rationale": "Productive unstressed -ing nasal-fronting form of racing."
      },
      "legacy_cmu": {
        "status": "confirmed-oov",
        "matches": []
      }
    },
    {
      "id": "oov-013",
      "surface": "rollin'",
      "normalized": "rollin",
      "accepted_pronunciations": [
        "R OW1 L IH0 N"
      ],
      "category": "dropped-sound",
      "region": "national-aae",
      "evidence": [
        "green-aae-phonology",
        "weldon-aae-variation"
      ],
      "adjudication": {
        "state": "accepted",
        "rationale": "Productive unstressed -ing nasal-fronting form of rolling."
      },
      "legacy_cmu": {
        "status": "present-in-legacy-cmu",
        "matches": [
          "R AA1 L IH0 N",
          "R OW1 L IH0 N"
        ]
      }
    },
    {
      "id": "oov-014",